publication_title,print_identifier,online_identifier,date_first_issue_online,num_first_vol_online,num_first_issue_online,date_last_issue_online,num_last_vol_online,num_last_issue_online,title_url,first_author,title_id,embargo_info,coverage_depth,coverage_notes,publisher_name
"ASCE Conference Proceedings","","",2000-01-01,,,,,,"http://link.aip.org/link/?ASCECP",,"","","full text","Conference Proceedings; Backfile content added","American Society of Civil Engineers"
"International Journal of Geomechanics","1532-3641","1943-5622",2001-01-01,1,1,,,,"http://link.aip.org/link/?IJGNAI",,"","","full text","","American Society of Civil Engineers"
"Journal of Aerospace Engineering","0893-1321","1943-5525",1988-01-01,1,1,,,,"http://link.aip.org/link/?JAEEEZ",,"","","full text","Backfile content (1988-1989) added","American Society of Civil Engineers"
"Journal of Architectural Engineering","1076-0431","1943-5568",1995-01-01,1,1,,,,"http://link.aip.org/link/?JAEIED",,"","","full text","","American Society of Civil Engineers"
"Journal of Bridge Engineering","1084-0702","1943-5592",1996-01-01,1,1,,,,"http://link.aip.org/link/?JBENF2",,"","","full text","","American Society of Civil Engineers"
"Journal of Cold Regions Engineering","0887-381X","1943-5495",1987-01-01,1,1,,,,"http://link.aip.org/link/?JCRGEI",,"","","full text","Backfile content (1987-1989) added","American Society of Civil Engineers"
"Journal of Composites for Construction","1090-0268","1943-5614",1997-01-01,1,1,,,,"http://link.aip.org/link/?JCCOF2",,"","","full text","","American Society of Civil Engineers"
"Journal of Computing in Civil Engineering","0887-3801","1943-5487",1987-01-01,1,1,,,,"http://link.aip.org/link/?JCCEE5",,"","","full text","Backfile content (1987-1989) added","American Society of Civil Engineers"
"Journal of Construction Engineering and Management","0733-9364","1943-7862",1983-01-01,109,1,,,,"http://link.aip.org/link/?JCEMD4",,"","","full text","Backfile content (1983-1989) added","American Society of Civil Engineers"
"Journal of Energy Engineering","0733-9402","1943-7897",1983-01-01,109,1,,,,"http://link.aip.org/link/?JLEED9",,"","","full text","Backfile content (1983-1989) added","American Society of Civil Engineers"
"Journal of Engineering Mechanics","0733-9399","1943-7889",1983-01-01,109,1,,,,"http://link.aip.org/link/?JENMDT",,"","","full text","Backfile content (1983-1989) added","American Society of Civil Engineers"
"Journal of Environmental Engineering","0733-9372","1943-7870",1983-01-01,109,1,,,,"http://link.aip.org/link/?JOEEDU",,"","","full text","Backfile content (1983-1989) added","American Society of Civil Engineers"
"Journal of Geotechnical and Geoenvironmental Engineering","1090-0241","1943-5606",1997-01-01,123,1,,,,"http://link.aip.org/link/?JGGEFK",,"","","full text","","American Society of Civil Engineers"
"Journal of Geotechnical Engineering","0733-9410","",1990-01-01,116,1,1996-01-01,122,12,"http://link.aip.org/link/?JGENDZ",,"","","full text","","American Society of Civil Engineers"
"Journal of Hydraulic Engineering","0733-9429","1943-7900",1983-01-01,109,1,,,,"http://link.aip.org/link/?JHEND8",,"","","full text","Backfile content (1983-1989) added","American Society of Civil Engineers"
"Journal of Hydrologic Engineering","1084-0699","1943-5584",1996-01-01,1,1,,,,"http://link.aip.org/link/?JHYEFF",,"","","full text","","American Society of Civil Engineers"
"Journal of Infrastructure Systems","1076-0342","1943-555X",1995-01-01,1,1,,,,"http://link.aip.org/link/?JITSE4",,"","","full text","","American Society of Civil Engineers"
"Journal of Irrigation and Drainage Engineering","0733-9437","1943-4774",1983-01-01,109,1,,,,"http://link.aip.org/link/?JIDEDH",,"","","full text","Backfile content (1983-1989) added","American Society of Civil Engineers"
"Journal of Legal Affairs and Dispute Resolution in Engineering and Construction","1943-4162","1943-4170",2009-01-01,1,1,,,,"http://link.aip.org/link/?JLADAH",,"","","full text","new journal on Scitation from January 15, 2009","American Society of Civil Engineers"
"Journal of Management in Engineering","9742-597X","",1985-01-01,1,1,1994-01-01,10,6,"http://link.aip.org/link/?JMENEA",,"","","full text","Backfile content (1985-1989) added","American Society of Civil Engineers"
"Journal of Management in Engineering","0742-597X","1943-5479",1995-01-01,11,1,,,,"http://link.aip.org/link/?JMENEA",,"","","full text","","American Society of Civil Engineers"
"Journal of Materials in Civil Engineering","0899-1561","1943-5533",1989-01-01,1,1,,,,"http://link.aip.org/link/?JMCEE7",,"","","full text","Backfile content (1989) added","American Society of Civil Engineers"
"Journal of Performance of Constructed Facilities","0887-3828","1943-5509",1987-01-01,1,1,,,,"http://link.aip.org/link/?JPCFEV",,"","","full text","Backfile content (1987-1989) added","American Society of Civil Engineers"
"Journal of Pipeline Systems Engineering and Practice","","",2010-01-01,1,1,,,,"http://link.aip.org/link?/JPSEA2",,"","","full text","new journal for 2010","American Society of Civil Engineers"
"Journal of Professional Issues in Engineering Education and Practice","1052-3928","1943-5541",1983-01-01,109,1,1990-01-01,116,4,"http://link.aip.org/link/?JPIEDN",,"","","full text","coden change for the journal","American Society of Civil Engineers"
"Journal of Structural Engineering","0733-9445","1943-541X",1983-01-01,109,1,,,,"http://link.aip.org/link/?JSENDH",,"","","full text","Backfile content (1983-1989) added","American Society of Civil Engineers"
"Journal of Surveying Engineering","0733-9453","1943-5428",1983-01-01,109,1,,,,"http://link.aip.org/link/?JSUED2",,"","","full text","Backfile content (1983-1989) added","American Society of Civil Engineers"
"Journal of Transportation Engineering","0733-947X","1943-5436",1983-01-01,109,1,,,,"http://link.aip.org/link/?JTPEDI",,"","","full text","Backfile content (1983-1989) added","American Society of Civil Engineers"
"Journal of Urban Planning and Development","0733-9488","1943-5444",1983-01-01,109,1,,,,"http://link.aip.org/link/?JUPDDM",,"","","full text","Backfile content (1983-1989) added","American Society of Civil Engineers"
"Journal of Water Resources Planning and Management","0733-9496","1943-5452",1983-01-01,109,1,,,,"http://link.aip.org/link/?JWRMD5",,"","","full text","Backfile content (1983-1989) added","American Society of Civil Engineers"
"Journal of Waterway, Port, Coastal and Ocean Engineering","0733-950X","1943-5460",1983-01-01,109,1,,,,"http://link.aip.org/link/?JWPED5",,"","","full text","Backfile content (1983-1989) added","American Society of Civil Engineers"
"Leadership and Management in Engineering","1532-6748","1943-5630",2001-01-01,1,1,,,,"http://link.aip.org/link/?LMEEAZ",,"","","full text","","American Society of Civil Engineers"
"Natural Hazards Review","1527-6988","1527-6996",2000-01-01,1,1,,,,"http://link.aip.org/link/?NHREFO",,"","","full text","","American Society of Civil Engineers"
"Practice Periodical of Hazardous, Toxic, and Radioactive Waste Management","1090-025X","",1997-01-01,1,1,2010-01-01,14,4,"http://link.aip.org/link/?PPHMF8",,"","","full text","","American Society of Civil Engineers"
"Journal of Hazardous, Toxic and Radioactive Waste ","2153-5493","2153-5515",2011-01-01,15,1,,,,"",,"","","full text","","American Society of Civil Engineers"
"Practice Periodical on Structural Design and Construction","1084-0680","",1996-01-01,1,1,,,,"http://link.aip.org/link/?PPSCFX",,"","","full text","","American Society of Civil Engineers"
"Journal of Nanomechanics and Micromechanics ","2153-5434","2153-5477",2011-01-01,1,1,,,,"",,"","","full text","","American Society of Civil Engineers"
