publication_title,print_identifier,online_identifier,date_first_issue_online,num_first_vol_online,num_first_issue_online,date_last_issue_online,num_last_vol_online,num_last_issue_online,title_url,first_author,title_id,embargo_info,coverage_depth,coverage_notes,publisher_name
"Studies in Economics and Finance","1086-7376","",1977-02-01,1,1,,,,"http://www.emeraldinsight.com/1086-7376.htm",,"","","fulltext","",""
"Supply Chain Management: An International Journal","1359-8546","",1996-04-01,1,1,,,,"http://www.emeraldinsight.com/1359-8546.htm",,"","","fulltext","",""
"Sustainability Accounting, Management and Policy Journal","2040-8021","",2010-07-03,1,1,,,,"http://www.emeraldinsight.com/2040-8021.htm",,"","","fulltext","",""
"Team Performance Management","1352-7592","",1995-03-01,1,1,,,,"http://www.emeraldinsight.com/1352-7592.htm",,"","","fulltext","",""
"The TQM Journal","1754-2731","",2008-01-11,20,1,,,,"http://www.emeraldinsight.com/1754-2731.htm",,"","","fulltext","Previously: The TQM Magazine",""
"The TQM Magazine","0954-478X","",1988-02-01,1,1,2007-10-09,19,6,"http://www.emeraldinsight.com/0954-478X.htm",,"","","fulltext","Now: The TQM Journal. Incorporates: Training for Quality",""
"Training for Quality","0968-4875","",1993-06-01,1,1,1997-12-01,5,4,"http://www.emeraldinsight.com/0968-4875.htm",,"","","fulltext","Merged into: The TQM Magazine",""
"Therapeutic Communities: The International Journal of Therapeutic Communities","0964-1866","",2012-09-03,33,1,,,,"http://www.emeraldinsight.com/0964-1866.htm",,"","","fulltext","",""
"Tizard Learning Disability Review","1359-5474","",1996-04-01,1,3,,,,"http://www.emeraldinsight.com/1359-5474.htm",,"","","fulltext","",""
"Tourism Review","1660-5373","",1946-02-01,1,1,,,,"http://www.emeraldinsight.com/1660-5373.htm",,"","","fulltext","",""
"Transforming Government: People, Process and Policy","1750-6166","",2007-03-01,1,1,,,,"http://www.emeraldinsight.com/1750-6166.htm",,"","","fulltext","",""
"VINE","0305-5728","1474-1032",1971-02-01,1,1,,,,"http://www.emeraldinsight.com/0305-5728.htm",,"","","fulltext","",""
"Working with Older People","1366-3666","",2000-01-01,4,1,,,,"http://www.emeraldinsight.com/1366-3666.htm",,"","","fulltext","",""
"World Class Design to Manufacture","1352-3074","",1994-02-01,1,1,1995-12-01,2,6,"http://www.emeraldinsight.com/1352-3074.htm",,"","","fulltext","Ceased publication",""
"World Journal of Entrepreneurship, Management and Sustainable Development","2042-5961","",2010-01-01,6,1,,,,"http://www.emeraldinsight.com/2042-5961.htm",,"","","fulltext","",""
"World Journal of Science, Technology and Sustainable Development","2042-5945","",2010-02-01,7,1,,,,"http://www.emeraldinsight.com/2042-5945.htm",,"","","fulltext","",""
"Worldwide Hospitality and Tourism Themes","1755-4217","",2009-04-10,1,1,,,,"http://www.emeraldinsight.com/1755-4217.htm",,"","","fulltext","",""
"Young Consumers: Insight and Ideas for Responsible Marketers","1747-3616","",1999-02-01,1,1,,,,"http://www.emeraldinsight.com/1747-3616.htm",,"","","fulltext","",""
